{
  "schemaVersion": "1.0.0",
  "subscriptionRef": "target-subscription",
  "inScope": [
    {
      "kind": "resourceGroup",
      "selector": "<RESOURCE_GROUP_NAME>"
    }
  ],
  "outOfScope": [],
  "observationPeriod": {
    "start": "2026-01-01T00:00:00Z",
    "end": "2026-01-08T00:00:00Z"
  },
  "executionLimits": {
    "maxToolCalls": 100,
    "maxWallClockSeconds": 600,
    "maxResultSetRows": 500,
    "perQueryTimeoutSeconds": 30
  },
  "generatedAt": "2026-01-08T00:00:00Z",
  "generatedAgainst": "<DISCOVERY_RUN_IDENTIFIER>",
  "canonicalHash": "bb5f683d70e0a3839a31939f681e568614d1ce963d491b17eba07ba1061a3f0c"
}
